{
  "kind": "repobrief.patch_evaluation",
  "version": "v1",
  "authority": "external_evaluation_evidence",
  "producer": {
    "name": "patch-evaluation-sidecar",
    "version": "0.1.0",
    "commit": "0000000000000000000000000000000000000000",
    "url": null
  },
  "created_at": "2026-07-06T12:00:00Z",
  "input": {
    "repo": "heimgewebe/lenskit",
    "branch": "feat/example",
    "base_commit": "45ec568775286374e4a50e9f2d8a1e1bc5886a7a",
    "commit": null,
    "pull_request": null,
    "patch_id": "patch-0001"
  },
  "repobrief_context": {
    "bundle_manifest": "out/lenskit.bundle.manifest.json",
    "snapshot_run_id": "run-0001",
    "workbench_outputs": ["relation_cards.json"],
    "cited_ranges": ["merger/lenskit/core/merge.py:120-140"],
    "citations": ["cit-000123"]
  },
  "workspace": {
    "isolated": true,
    "workspace_id": "eval-ws-0001",
    "base_commit": "45ec568775286374e4a50e9f2d8a1e1bc5886a7a"
  },
  "patch": {
    "applied": true,
    "patch_id": "patch-0001",
    "format": "git-diff",
    "sha256": "0000000000000000000000000000000000000000000000000000000000000000",
    "changed_files": [
      { "path": "merger/lenskit/core/merge.py", "change": "modified" }
    ]
  },
  "command_policy": {
    "allowed_commands": ["python -m pytest"],
    "network": "deny",
    "secrets_policy": "none",
    "timeout_seconds": 600
  },
  "commands_run": [
    {
      "command": "python -m pytest merger/lenskit/tests/test_merge.py",
      "status": "passed",
      "exit_code": 0,
      "started_at": "2026-07-06T12:00:05Z",
      "duration_ms": 4200,
      "log_ref": "logs/pytest.log",
      "truncated": false
    }
  ],
  "environment": {
    "os": "linux",
    "runner": "sidecar-runner",
    "container": null,
    "tool_versions": {
      "python": "3.11.9",
      "pytest": "8.2.0"
    }
  },
  "status": "passed",
  "does_not_establish": [
    "correctness",
    "test_sufficiency",
    "security_correctness",
    "runtime_behavior_outside_evaluated_commands",
    "merge_authorization",
    "merge_readiness",
    "regression_absence",
    "repo_understood",
    "claims_true"
  ]
}
